{
  "schema_version": 1,
  "intent_id": "1111cccc-1111-4111-8111-111111111111",
  "correlation_id": "22222222-2222-4222-8222-222222222222",
  "request_id": "req-01HZY.machine-boundary_001",
  "idempotency_key": "campaign-eeee-week37-gate-M00-seq-1",
  "canonical_gate_id": "M(0,0;1,0)",
  "event_kind": "close",
  "event_sequence": 1,
  "gate_event_sequence": 1,
  "device_id": "scada-rtu-07",
  "adapter_gate_id": "ch3",
  "capability_release_id": "cap-2026-07-19-a",
  "capability_hash": "aaaaaaaaaaaaaaaaaaaaaaaaaaaaaaaaaaaaaaaaaaaaaaaaaaaaaaaaaaaaaaaa",
  "target_position_m": 0.0,
  "target_level": 3,
  "not_before": "2026-07-20T00:00:00Z",
  "deadline": "2026-07-20T06:00:00Z",
  "mode": "shadow",
  "lineage": {
    "campaign_id": "eeeeeeee-eeee-4eee-8eee-eeeeeeeeeeee",
    "plan_id": "aaaaaaaa-aaaa-4aaa-8aaa-aaaaaaaaaaaa",
    "plan_version": 1,
    "input_content_hash": "1111111111111111111111111111111111111111111111111111111111111111",
    "draft_content_hash": "2222222222222222222222222222222222222222222222222222222222222222",
    "requirement_run_id": "bbbbbbbb-bbbb-4bbb-8bbb-bbbbbbbbbbbb",
    "requirement_version": 3,
    "requirement_set_sha256": "3333333333333333333333333333333333333333333333333333333333333333",
    "model_snapshot_id": "4444444444444444444444444444444444444444444444444444444444444444",
    "model_release_id": "engineering-prior-v3-v1",
    "model_release_content_hash": "5555555555555555555555555555555555555555555555555555555555555555",
    "prediction_run_id": "6666666666666666666666666666666666666666666666666666666666666666",
    "prediction_identity_version": 2,
    "engine_descriptor_content_hash": "7777777777777777777777777777777777777777777777777777777777777777",
    "artifact_sha256": "8888888888888888888888888888888888888888888888888888888888888888"
  }
}
